"#starttime";"#endtime";"transcription";"sentimentAnnotations"
0.000;4.822;"// Y: porque no me gusta, por los mismos reflejos dorados creo que son en exceso.";"-1"
4.822;13.692;"// eh: yo por ejemplo al momento de aplicarlo, tienes que utilizar las manos obviamente, y las manos te quedan: con con una sensacion seca,";"-1"
13.692;19.243;"em: toda brillante en donde es- aunque te laves cuarenta veces aun asi te quedan brillos en las mano.";"-1"
19.243;23.747;"Entonces super super incomodo, // eh: utilizar esta crema";"-1"
23.747;27.975;"-pun dice que es humectante y no siento que me humecta, incluso siento que me seca mas la piel.";"-1"
27.975;29.187;"Otro producto que no l-";"-1"
