"#starttime";"#endtime";"speech";"sentimentAnnotations"
0.000;6.183;"Eh: no te quita ni: ni la mascara normal de pestana, ni la resistente, ni nada. Te escuece muchisimo.";"-1"
6.183;11.222;"Pone, limpia y en profundidad, pues no a mi no me desmaquilla, ni en profundidad ni sin profundidad.";"-1"
11.222;13.707;"Me pica muchisimo, mm:";"-1"
13.707;16.873;"para que se quite bien te tienes que estar restregando, por lo menos para mi.";"-1"
16.873;22.217;"Y la verdad que es un producto que compre porque, bueno, porque: era economico y era un desmaquillador. Que";"1"
22.217;30.485;"que la verdad es que, mm habia otro que era: es mas chiquitin y era bifasico y ese si me gustaba muchisimo. Pero lo retiraron y bueno, pues me compre este para probarlo";"1"
30.485;34.992;"y: no me gusto, no me gusto y yo digo que no:, no lo volveria comprar en la vida eterna.";"-1"
