"#starttime";"#endtime";"Speech";"sentimentAnnotations"
0.000;9.240;"// Decian que que te c- calmaba rojeces, que incluso las venitas esas rotas al contacto te las eliminaba. //";"-1"
9.240;13.171;"Maravillas, como que esto era la solucion a todo enrojecimiento del mundo. //";"1"
13.171;16.982;"!pues no! o sea, es un polvo amarillo. No es mas que un polvo amarillo y ya. //";"-1"
16.982;22.770;"No hace nada extraordinario, no calma, no: nada o sea es // totalmente equis ";"-1"
22.780;31.850;"o sea digo no lo voy a tirar a la basura porque pues finalmente es un polvo amarillo que me  ayuda un poquito ah: neutralizar// el rojo";"1"
31.850;34.366;"Pero no cumple con esas promesas que venian";"-1"
