"#starttime";"#endtime";"speech";"sentimentAnnotations"
0.000;4.200;"Me di cuenta al cabo de muchos anos que este era mi libro favorito porque,";"1"
4.200;8.051;"siempre recurro a el cuando me apetece leer algo que se que me va a gustar.";"1"
8.051;13.360;"Siempre recurro a el cuando me apetece:, pues no se //";"1"
13.360;15.942;"siempre recurro a el y ya esta.";"1"
15.942;21.900;"Me: me di cuenta de que siempre era el libro que buscaba, siempre era el libro que, que tenia en la mente";"1"
21.900;25.753;"Siempre era el libro del que hablaba de los personajes, siempre comparo los personajes con otros";"1"
25.753;28.000;"siempre estoy ahi metida en el mundo de este libro. ";"1"
28.000;34.551;"Asi que eh decidi, que este era mi libro favorito y en realidad creo que no me he equivocado. Eh, dandome cuenta de";"1"
