"#starttime";"#endtime";"Speech";"sentimentAnnotations"
0.000;4.611;"En este color, creo que era el color frambuesa. //";"0"
4.611;7.744;"Pinta hermosisimo. //";"1"
7.744;13.290;"Sinceramente, con respecto a lo que pinta y a que son hidratantes, si son muy hidratantes";"1"
13.290;20.110;"pero el problema de estos labiales / es que cuand o uno se los aplica, te dejan un gusto asqueroso / en la boca. ";"-1"
20.110;27.794;"Sinceramente, es no es que sea el olor sino que es mas bien el gusto. Es como un gusto // co-";"-1"
