"#starttime";"#endtime";"Speech";"sentimentAnnotation"
0.000;2.720;"Y a mi me ha encantado leerlo, porque he aprendido muchisimo.";"1"
2.740;11.204;"Te- es la historia de una costurera que: bueno que por distintas azares de la vida se tiene que ir a Africa, Tetuan.";"0"
11.204;20.312;"Y bueno ahi e- desarrolla el oficio de costurera. Se hace modista. Y: considera llegar un poco a las altas esferas, hacer algun trabajo de espionaje.";"0"
20.312;25.525;"Y bueno es una vision que a mi me ha gustado muchisimo de, de este tiempo. Y he aprendido mucho.";"1"
25.525;29.006;"Asi que, aparte de que esta muy bien narrado, a mi me encanta.";"1"
29.006;32.392;"Asi que os lo recomiendo. // Y";"1"
