"#starttime";"#endtime";"Speech";"sentimentAnnotations"
0.000;8.934;"Me miro en el espejo. Y es que, v- vamos / detras de esa capa de aceite / mm pues mm puedo imaginar que esta mi cara.";"-1"
8.934;17.822;"// Pero: solo me lo imagino. Hasta que no me la lavo, no lo se seguro; porque es que esto es // ¡agh!";"-1"
17.822;19.032;"¡no puedo!";"-1"
19.032;20.830;"¡No! me saca muchisima grasa. ";"-1"
20.830;30.186;"Yo entiendo que por la noche, yo me- llegaba a poner cremas nutritivas para pieles secas por la noche; porque yo entiendo que tengo zonas de la cara / que mm no tengo";"1"
