"#starttime";"#endtime";"Speech";"sentimentAnnotations"
0.000;7.190;"Pero yo porque que tengo que pagar diez euros / por un producto / por tres productos cuando solamente estoy utilizando uno.";"-1"
7.190;9.978;"Este corrector a mi no me vale diez euros.";"-1"
9.978;13.235;"Pero es que en realidad esta paleta vale veinte, porque yo lo compre a cincuenta por cien.";"-1"
13.235;15.400;"O sea, ¡ni loca! , ¡ni loca! ";"-1"
15.400;18.541;" el unico aprovechable, por lo menos para mi, es este de aqui";"1"
18.541;23.766;"Este no lo he usado, o no lo u- n- no lo he usado casi nunca, y este no me ilumina nada, o sea, pff.";"-1"
23.766;31.346;"// No, este producto: no. En conjunto, este producto a para mi no merece la pena. / para nada.";"-1"
