"#starttime";"#endtime";"Speech";"sentimentAnnotations"
0.000;6.472;"En la caja, que la he tirado, dice que se puede utilizar eh como base de maq- como base para el maquillaje.";"0"
6.472;11.288;"Yo no lo haria, vale, porque si que es cierto que deja un poquito de sensacion grasa.";"-1"
11.288;18.236;"No tanta como otras cremas e- que he utilizado de proteccion cincuenta, pero si que deja. //";"-1"
18.236;22.100;"Huele muchi:simo a protector solar.  Es algo que no me gusta mucho. ";"-1"
22.100;25.045;"¡El pelo me esta volviendo loca!// ¡Ay!";"-1"
25.045;27.013;"No me voy a dej- es algo que no me gusta tanto que";"-1"
27.013;30.996;"// Huele mu:cho a protector solar.";"-1"
30.996;33.414;"Entonces:, bueno, preferiria que no oliese tanto";"-1"
